{
  "name": "AWS Community Day Bengaluru 2026",
  "type": "event",
  "date": "2026-07-11",
  "location": "Bengaluru",
  "logo": "../../assets/collaborations/aws-community-day-bengaluru-2026.png",
  "blurb": "Joined fellow AWS communities to volunteer and take part in the regional Community Day.",
  "order": 1
}
